{
  "topic": "Thread Safety: `std::atomic` Guarantees Indivisible Operations",
  "category": "thread",
  "explanation": "Assumption: Any variable type can be safely modified concurrently if its operations are simple. Reality: Only types wrapped by `std::atomic` guarantee thread safety for operations like incrementation. An atomic operation executes as a single, indivisible unit (often implemented via hardware synchronization primitives), ensuring that concurrent increments result in the mathematically correct value (e.g., two increments yield a value of 2). Why It Works: `std::atomic` prevents data races by ensuring that the read, modify, and write steps of an operation cannot be interleaved by other threads.",
  "code_example": "std::atomic<int> ac(0);\n// Thread 1: ++ac; \n// Thread 2: ++ac; \n// ac is guaranteed to be 2.",
  "practical_example": "Using `std::atomic` for shared counters, reference counts, or flags in multi-threaded applications ensures system integrity without requiring manual locking mechanisms for basic operations.",
  "keywords": [
    "std::atomic",
    "indivisible",
    "thread safety",
    "atomicity"
  ],
  "difficulty": "intermediate",
  "page_reference": "289-297",
  "chapter": "Item 40",
  "id": "emcpp_thread_thread_safety___std_8353eb",
  "book": "Effective Modern C++ by Scott Meyers"
}